<?xml version="1.0" encoding="euc-kr" standalone="no"?>

<!DOCTYPE booklist SYSTEM "SAXSample.dtd">

<!-- 책 정보에 관한 XML -->

<booklist>
	<book isbn="h0-596-00762-0">
		<name outpage="ProgrammingNETComponents.gif">
			&bookname;
		</name>
		<authors>
			<author>Juval Lowy</author>
		</authors>
		<page><![CDATA[ 648 ]]></page>
		<publish year="2005" month="06" />
		<price unit="won">51300</price>
	</book>
</booklist>